<?xml version="1.0" encoding="UTF-8"?>
<im-copilot-driver-config xmlns="https://www.intra-mart.jp/im-copilot/im-copilot-driver-config" xmlns:xsi="http://www.w3.org/2001/XMLSchema-instance" xsi:schemaLocation="https://www.intra-mart.jp/im-copilot/im-copilot-driver-config ../schema/im-copilot-driver-config.xsd ">

  <!-- Linkage Driver Setting for Common to Tenants -->
  <default-drivers>
    <driver type="open-ai">
      <api-key>sk-0000XXXXXX</api-key>
      <base-url>https://api.openai.com/v1</base-url>
      <organization>YYYYYY</organization>
      <retry-count>3</retry-count>
      <retry-wait>1</retry-wait>
      <parameters>
        <parameter>
          <parameter-name>default-chat-model</parameter-name>
          <parameter-value>gpt-5.4-mini</parameter-value>
        </parameter>
        <parameter>
          <parameter-name>default-embeddings-model</parameter-name>
          <parameter-value>text-embedding-3-small</parameter-value>
        </parameter>
        <parameter>
          <parameter-name>default-images-model</parameter-name>
          <parameter-value>gpt-image-1-mini</parameter-value>
        </parameter>
        <parameter>
          <parameter-name>default-speech-model</parameter-name>
          <parameter-value>tts-1</parameter-value>
        </parameter>
        <parameter>
          <parameter-name>default-speech-voice</parameter-name>
          <parameter-value>echo</parameter-value>
        </parameter>
        <parameter>
          <parameter-name>default-transcription-model</parameter-name>
          <parameter-value>gpt-4o-mini-transcribe</parameter-value>
        </parameter>
      </parameters>
    </driver>
    <driver type="azure-open-ai">
      <api-key>9999XXXXXX</api-key>
      <base-url>https://openai-service-foo.openai.azure.com/openai/</base-url>
      <retry-count>3</retry-count>
      <retry-wait>1</retry-wait>
      <parameters>
        <parameter>
          <parameter-name>default-chat-deployment-id</parameter-name>
          <parameter-value>gpt-5.4-mini</parameter-value>
        </parameter>
        <parameter>
          <parameter-name>default-embeddings-deployment-id</parameter-name>
          <parameter-value>text-embedding-ada-002</parameter-value>
        </parameter>
        <parameter>
          <parameter-name>default-images-deployment-id</parameter-name>
          <parameter-value>gpt-image-1-mini</parameter-value>
        </parameter>
        <parameter>
          <parameter-name>default-transcription-deployment-id</parameter-name>
          <parameter-value>gpt-4o-mini-transcribe</parameter-value>
        </parameter>
      </parameters>
    </driver>
    <driver type="amazon-bedrock">
      <aws-region>ap-northeast-1</aws-region>
      <aws-credentials-profile>default</aws-credentials-profile>
      <parameters>
        <parameter>
          <parameter-name>default-chat-model</parameter-name>
          <parameter-value>global.anthropic.claude-haiku-4-5-20251001-v1:0</parameter-value>
        </parameter>
        <parameter>
          <parameter-name>default-chat-max-tokens</parameter-name>
          <parameter-value>4096</parameter-value>
        </parameter>
        <parameter>
          <parameter-name>default-embeddings-model</parameter-name>
          <parameter-value>amazon.titan-embed-text-v1</parameter-value>
        </parameter>
      </parameters>
    </driver>
  </default-drivers>

  <!-- Linkage Driver Setting for foo Tenant -->
  <drivers tenant="foo">
    <driver type="open-ai">
      <api-key>sk-1111XXXXXX</api-key>
      <base-url>https://api.openai.com/v1</base-url>
      <organization>YYYYYY</organization>
      <retry-count>3</retry-count>
      <retry-wait>1</retry-wait>
      <parameters>
        <parameter>
          <parameter-name>default-chat-model</parameter-name>
          <parameter-value>gpt-5.4-mini</parameter-value>
        </parameter>
        <parameter>
          <parameter-name>default-embeddings-model</parameter-name>
          <parameter-value>text-embedding-3-small</parameter-value>
        </parameter>
        <parameter>
          <parameter-name>default-images-model</parameter-name>
          <parameter-value>gpt-image-1-mini</parameter-value>
        </parameter>
        <parameter>
          <parameter-name>default-speech-model</parameter-name>
          <parameter-value>tts-1</parameter-value>
        </parameter>
        <parameter>
          <parameter-name>default-speech-voice</parameter-name>
          <parameter-value>echo</parameter-value>
        </parameter>
        <parameter>
          <parameter-name>default-transcription-model</parameter-name>
          <parameter-value>gpt-4o-mini-transcribe</parameter-value>
        </parameter>
      </parameters>
    </driver>
    <driver type="azure-open-ai">
      <api-key>5555XXXXXX</api-key>
      <base-url>https://openai-service-foo.openai.azure.com/openai/</base-url>
      <retry-count>3</retry-count>
      <retry-wait>1</retry-wait>
      <parameters>
        <parameter>
          <parameter-name>default-chat-deployment-id</parameter-name>
          <parameter-value>gpt-5.4-mini</parameter-value>
        </parameter>
        <parameter>
          <parameter-name>default-embeddings-deployment-id</parameter-name>
          <parameter-value>text-embedding-ada-002</parameter-value>
        </parameter>
        <parameter>
          <parameter-name>default-images-deployment-id</parameter-name>
          <parameter-value>gpt-image-1-mini</parameter-value>
        </parameter>
        <parameter>
          <parameter-name>default-transcription-deployment-id</parameter-name>
          <parameter-value>gpt-4o-mini-transcribe</parameter-value>
        </parameter>
      </parameters>
    </driver>
    <driver type="amazon-bedrock">
      <aws-region>ap-northeast-1</aws-region>
      <aws-credentials-static>
        <access-key>XXXXXX</access-key>
        <secret-key>YYYYYY</secret-key>
      </aws-credentials-static>
      <parameters>
        <parameter>
          <parameter-name>default-chat-model</parameter-name>
          <parameter-value>global.anthropic.claude-haiku-4-5-20251001-v1:0</parameter-value>
        </parameter>
        <parameter>
          <parameter-name>default-chat-max-tokens</parameter-name>
          <parameter-value>4096</parameter-value>
        </parameter>
        <parameter>
          <parameter-name>default-embeddings-model</parameter-name>
          <parameter-value>amazon.titan-embed-text-v1</parameter-value>
        </parameter>
      </parameters>
    </driver>
  </drivers>

  <!-- Linkage Driver Setting for bar Tenant -->
  <drivers tenant="bar">
    <driver type="azure-open-ai">
      <api-key>0000XXXXXX</api-key>
      <base-url>https://openai-service-foo.openai.azure.com/openai/</base-url>
      <retry-count>3</retry-count>
      <retry-wait>1</retry-wait>
      <parameters>
        <parameter>
          <parameter-name>default-chat-deployment-id</parameter-name>
          <parameter-value>gpt-5.4-mini</parameter-value>
        </parameter>
        <parameter>
          <parameter-name>default-embeddings-deployment-id</parameter-name>
          <parameter-value>text-embedding-ada-002</parameter-value>
        </parameter>
        <parameter>
          <parameter-name>default-images-deployment-id</parameter-name>
          <parameter-value>gpt-image-1-mini</parameter-value>
        </parameter>
        <parameter>
          <parameter-name>default-transcription-deployment-id</parameter-name>
          <parameter-value>gpt-4o-mini-transcribe</parameter-value>
        </parameter>
      </parameters>
    </driver>
    <driver type="amazon-bedrock">
      <aws-region>ap-northeast-1</aws-region>
      <aws-credentials-iam-role-arn>ZZZZZZ</aws-credentials-iam-role-arn>
      <parameters>
        <parameter>
          <parameter-name>default-chat-model</parameter-name>
          <parameter-value>global.anthropic.claude-haiku-4-5-20251001-v1:0</parameter-value>
        </parameter>
        <parameter>
          <parameter-name>default-chat-max-tokens</parameter-name>
          <parameter-value>4096</parameter-value>
        </parameter>
        <parameter>
          <parameter-name>default-embeddings-model</parameter-name>
          <parameter-value>amazon.titan-embed-text-v1</parameter-value>
        </parameter>
      </parameters>
    </driver>
  </drivers>

</im-copilot-driver-config>
